{
  "$schema": "https://ui.shadcn.com/schema/registry-item.json",
  "name": "accordion",
  "type": "registry:ui",
  "title": "Accordion",
  "description": "A vertically stacked set of interactive headings that each reveal a section of content.",
  "dependencies": [
    "@ark-ui/react",
    "lucide-react"
  ],
  "registryDependencies": [],
  "files": [
    {
      "path": "../../packages/ui-react/src/components/base/accordion.tsx",
      "content": "\"use client\";\n\nimport { Accordion as AccordionPrimitive } from \"@ark-ui/react/accordion\";\nimport { ChevronDownIcon } from \"lucide-react\";\nimport type { ComponentProps } from \"react\";\n\nimport { cn } from \"@/lib/utils\";\n\nfunction Accordion({\n  className,\n  ...props\n}: ComponentProps<typeof AccordionPrimitive.Root>) {\n  return (\n    <AccordionPrimitive.Root className={cn(\"w-full\", className)} {...props} />\n  );\n}\n\nfunction AccordionItem({\n  className,\n  ...props\n}: ComponentProps<typeof AccordionPrimitive.Item>) {\n  return (\n    <AccordionPrimitive.Item\n      className={cn(\"border-b border-border last:border-b-0\", className)}\n      {...props}\n    />\n  );\n}\n\nfunction AccordionTrigger({\n  className,\n  children,\n  ...props\n}: ComponentProps<typeof AccordionPrimitive.ItemTrigger>) {\n  return (\n    <AccordionPrimitive.ItemTrigger\n      className={cn(\n        \"group flex w-full items-center gap-4 py-4 text-left cursor-pointer text-sm font-medium transition-all outline-none\",\n        \"hover:underline\",\n        \"focus-visible:outline-none focus-visible:ring-2 focus-visible:ring-ring focus-visible:ring-offset-2\",\n        \"disabled:pointer-events-none disabled:opacity-50\",\n        \"[&[data-state=open]>.accordion-chevron]:rotate-180\",\n        className\n      )}\n      {...props}\n    >\n      <span className=\"flex-1\">{children}</span>\n      <ChevronDownIcon className=\"accordion-chevron text-muted-foreground pointer-events-none size-4 shrink-0 transition-transform duration-200 ml-auto\" />\n    </AccordionPrimitive.ItemTrigger>\n  );\n}\n\nfunction AccordionContent({\n  className,\n  children,\n  ...props\n}: ComponentProps<typeof AccordionPrimitive.ItemContent>) {\n  return (\n    <AccordionPrimitive.ItemContent\n      className={cn(\n        \"overflow-hidden text-sm\",\n        // Ark UI recommended animations (matches selection prompt)\n        \"data-[state=closed]:opacity-0 data-[state=open]:opacity-100\",\n        \"data-[state=closed]:animate-accordion-collapse data-[state=open]:animate-accordion-expand\",\n        // Ark UI recommended data selectors for custom animations:\n        \"[data-scope=accordion][data-part=item-content][data-state=open]:animate-[slideDown_250ms_ease-in-out]\",\n        \"[data-scope=accordion][data-part=item-content][data-state=closed]:animate-[slideUp_200ms_ease-in-out]\",\n        className\n      )}\n      {...props}\n    >\n      <div className=\"min-h-0 pb-4 pt-0\">{children}</div>\n    </AccordionPrimitive.ItemContent>\n  );\n}\n\nexport { Accordion, AccordionItem, AccordionTrigger, AccordionContent };\n",
      "type": "registry:ui"
    }
  ],
  "cssVars": {
    "theme": {
      "--animate-accordion-collapse": "accordion-collapse var(--tw-duration, 200ms) ease-out",
      "--animate-accordion-expand": "accordion-expand var(--tw-duration, 200ms) ease-out"
    }
  },
  "css": {
    "@keyframes accordion-collapse": {
      "from": {
        "height": "var(--height)"
      },
      "to": {
        "height": "0"
      }
    },
    "@keyframes accordion-expand": {
      "from": {
        "height": "0"
      },
      "to": {
        "height": "var(--height)"
      }
    }
  }
}