{
  "$schema": "https://components.prashantindurkar.in/schema/registry-item.json",
  "name": "accordion",
  "type": "registry:ui",
  "title": "Accordion",
  "description": "A vertically stacked set of interactive headings that each reveal a section of content.",
  "dependencies": [
    "solid-js",
    "@ark-ui/solid",
    "lucide-solid"
  ],
  "files": [
    {
      "content": "import {\n  AccordionRoot,\n  AccordionItem as AccordionItemPrimitive,\n  AccordionItemTrigger as AccordionItemTriggerPrimitive,\n  AccordionItemContent as AccordionItemContentPrimitive,\n  type AccordionRootProps,\n  type AccordionItemProps,\n  type AccordionItemTriggerProps,\n  type AccordionItemContentProps,\n} from \"@ark-ui/solid/accordion\";\nimport { ChevronDownIcon } from \"lucide-solid\";\nimport type { JSX, ParentComponent } from \"solid-js\";\nimport { splitProps } from \"solid-js\";\n\nimport { cn } from \"@/lib/utils\";\n\nexport interface AccordionProps extends AccordionRootProps {}\n\nexport const Accordion: ParentComponent<AccordionProps> = (props) => {\n  const [local, rest] = splitProps(props, [\"class\", \"children\"]);\n  return (\n    <AccordionRoot class={cn(\"w-full\", local.class)} {...rest}>\n      {local.children}\n    </AccordionRoot>\n  );\n};\n\nexport interface AccordionItemComponentProps extends AccordionItemProps {}\n\nexport const AccordionItemComponent: ParentComponent<\n  AccordionItemComponentProps\n> = (props) => {\n  const [local, rest] = splitProps(props, [\"class\", \"children\"]);\n  return (\n    <AccordionItemPrimitive\n      class={cn(\"border-b border-border last:border-b-0\", local.class)}\n      {...rest}\n    >\n      {local.children}\n    </AccordionItemPrimitive>\n  );\n};\n\nexport interface AccordionTriggerComponentProps\n  extends AccordionItemTriggerProps {\n  /**\n   * Optional icon or content to display on the left side\n   */\n  leftIcon?: JSX.Element;\n  /**\n   * Optional icon or content to display on the right side\n   * If not provided, defaults to ChevronDownIcon\n   */\n  rightIcon?: JSX.Element;\n}\n\nexport const AccordionTriggerComponent: ParentComponent<\n  AccordionTriggerComponentProps\n> = (props) => {\n  const [local, rest] = splitProps(props, [\n    \"class\",\n    \"children\",\n    \"leftIcon\",\n    \"rightIcon\",\n  ]);\n  return (\n    <AccordionItemTriggerPrimitive\n      class={cn(\n        \"group flex w-full items-center gap-4 py-4 text-left cursor-pointer text-sm font-medium transition-all outline-none\",\n        \"hover:underline\",\n        \"focus-visible:outline-none focus-visible:ring-2 focus-visible:ring-ring focus-visible:ring-offset-2\",\n        \"disabled:pointer-events-none disabled:opacity-50\",\n        \"[&[data-state=open]>.accordion-chevron]:rotate-180\",\n        \"data-[state=closed]:text-primary/60 data-[state=closed]:hover:text-primary data-[state=open]:text-primary\",\n        local.class\n      )}\n      {...rest}\n    >\n      {/* Left Icon Slot */}\n      {local.leftIcon}\n\n      {/* Title/Content */}\n      <span class=\"flex-1\">{local.children}</span>\n\n      {/* Right Icon Slot */}\n      {local.rightIcon ? (\n        <span class=\"ml-auto\">{local.rightIcon}</span>\n      ) : (\n        <ChevronDownIcon class=\"accordion-chevron text-muted-foreground pointer-events-none size-4 shrink-0 transition-transform duration-200 ml-auto\" />\n      )}\n    </AccordionItemTriggerPrimitive>\n  );\n};\n\nexport interface AccordionContentComponentProps\n  extends AccordionItemContentProps {}\n\nexport const AccordionContentComponent: ParentComponent<\n  AccordionContentComponentProps\n> = (props) => {\n  const [local, rest] = splitProps(props, [\"class\", \"children\"]);\n  return (\n    <AccordionItemContentPrimitive\n      class={cn(\n        \"overflow-hidden text-sm\",\n        // Ark UI recommended animations (matches selection prompt)\n        \"data-[state=closed]:opacity-0 data-[state=open]:opacity-100\",\n        \"data-[state=closed]:animate-accordion-collapse data-[state=open]:animate-accordion-expand\",\n        // Ark UI recommended data selectors for custom animations:\n        \"[data-scope=accordion][data-part=item-content][data-state=open]:animate-[slideDown_250ms_ease-in-out]\",\n        \"[data-scope=accordion][data-part=item-content][data-state=closed]:animate-[slideUp_200ms_ease-in-out]\",\n        local.class\n      )}\n      {...rest}\n    >\n      <div class=\"pb-4\">{local.children}</div>\n    </AccordionItemContentPrimitive>\n  );\n};\n\n// Export with cleaner names\nexport {\n  AccordionItemComponent as AccordionItem,\n  AccordionTriggerComponent as AccordionTrigger,\n  AccordionContentComponent as AccordionContent,\n};\n",
      "path": "accordion.tsx",
      "type": "registry:ui",
      "exports": "export { AccordionProps, Accordion, AccordionItemComponentProps, AccordionItemComponent, AccordionTriggerComponentProps, AccordionTriggerComponent, AccordionContentComponentProps, AccordionContentComponent, AccordionItemComponent as AccordionItem, AccordionTriggerComponent as AccordionTrigger, AccordionContentComponent as AccordionContent } from './accordion'"
    }
  ]
}
